{
  "acceptance": {
    "state": "not_required"
  },
  "artifacts": {
    "events": "<ABSOLUTE_PATH>/state/jobs/1f3e6c9c-a473-42b4-9cac-eeecd7823bcf/evidence/events.jsonl",
    "events_normalized": "<ABSOLUTE_PATH>/state/jobs/1f3e6c9c-a473-42b4-9cac-eeecd7823bcf/evidence/events.v1.jsonl",
    "events_normalized_version": 1,
    "handoff": null,
    "stderr": "<ABSOLUTE_PATH>/state/jobs/1f3e6c9c-a473-42b4-9cac-eeecd7823bcf/evidence/stderr"
  },
  "attempt": 1,
  "change": {
    "state": "none"
  },
  "cost_usd": 0.0,
  "delegation": null,
  "dir": "<ABSOLUTE_PATH>/syn/primary",
  "effort": null,
  "execution": {
    "outcome": "completed"
  },
  "exit": 0,
  "finished": "20260821T220207Z",
  "freeze": null,
  "generation": 0,
  "harness": "opencode",
  "integrity": {
    "git_identity_after": "c68b6dcec3974b8caf9b7de557c2878e5d2332a274af9c0e8565b64481d1c3f7",
    "git_identity_before": "c68b6dcec3974b8caf9b7de557c2878e5d2332a274af9c0e8565b64481d1c3f7",
    "identity_changed": false,
    "outcome": "clean",
    "tree_after": "e2032d244136238ccbc0eccf6f6fa87d31fac71dcd334dc6d757a4c01f7a2601",
    "tree_before": "e2032d244136238ccbc0eccf6f6fa87d31fac71dcd334dc6d757a4c01f7a2601"
  },
  "job_id": "1f3e6c9c-a473-42b4-9cac-eeecd7823bcf",
  "lease_uuid": null,
  "mode": "readonly",
  "model": {
    "id": "opencode-go/deepseek-v4-flash",
    "identity_source": "registry",
    "model_family": "deepseek",
    "provider": "opencode-go",
    "vendor_family": "deepseek"
  },
  "policy_digest": "3554bd49e1b1fa30a4dcd48e722c61ab2ccd0bb572f4957cc144b9f0221d06ac",
  "process": {
    "pid": 298,
    "timed_out": false
  },
  "profile_digest": "14cb3795537615b5fc23ffbfa318ecba1987ecfb4380a5cdd36aae21b00c82b6",
  "provider": "opencode",
  "queued_s": 0.0,
  "review": null,
  "role": "scout",
  "schema_version": 1,
  "security": {
    "containment": {
      "backend": "bwrap",
      "ipc_namespace": true,
      "mount_namespace": true,
      "network_namespace": false,
      "pid_namespace": true,
      "uts_namespace": true
    },
    "credential": {
      "enters_worker": false,
      "posture": "none"
    },
    "identity": {
      "payload_uid": null,
      "uid_boundary": "same-user"
    },
    "network": {
      "broker_only": false,
      "direct": true
    }
  },
  "started": "20260821T220207Z",
  "status": "ok"
}
